<?xml version="1.0" encoding="UTF-8" standalone="yes"?>
<stack xmlns="urn:dukesdecks" xmlns:xsi="http://www.w3.org/2001/XMLSchema-instance" xsi:schemaLocation="cardschema.xsd">
    <card>
        <rank>7</rank>
        <suit>HEARTS</suit>
    </card>
    <card>
        <rank>J</rank>
        <suit>CLUBS</suit>
    </card>
    <card>
        <rank>9</rank>
        <suit>DIAMONDS</suit>
    </card>
    <card>
        <rank>5</rank>
        <suit>CLUBS</suit>
    </card>
    <card>
        <rank>K</rank>
        <suit>SPADES</suit>
    </card>
    <card>
        <rank>4</rank>
        <suit>HEARTS</suit>
    </card>
    <card>
        <rank>A</rank>
        <suit>DIAMONDS</suit>
    </card>
    <card>
        <rank>K</rank>
        <suit>HEARTS</suit>
    </card>
    <card>
        <rank>6</rank>
        <suit>SPADES</suit>
    </card>
    <card>
        <rank>6</rank>
        <suit>CLUBS</suit>
    </card>
    <card>
        <rank>5</rank>
        <suit>HEARTS</suit>
    </card>
    <card>
        <rank>7</rank>
        <suit>DIAMONDS</suit>
    </card>
    <card>
        <rank>Q</rank>
        <suit>SPADES</suit>
    </card>
    <card>
        <rank>2</rank>
        <suit>CLUBS</suit>
    </card>
    <card>
        <rank>7</rank>
        <suit>CLUBS</suit>
    </card>
    <card>
        <rank>J</rank>
        <suit>SPADES</suit>
    </card>
    <card>
        <rank>Q</rank>
        <suit>HEARTS</suit>
    </card>
    <card>
        <rank>2</rank>
        <suit>SPADES</suit>
    </card>
    <card>
        <rank>8</rank>
        <suit>DIAMONDS</suit>
    </card>
    <card>
        <rank>10</rank>
        <suit>HEARTS</suit>
    </card>
    <card>
        <rank>10</rank>
        <suit>DIAMONDS</suit>
    </card>
    <card>
        <rank>3</rank>
        <suit>DIAMONDS</suit>
    </card>
    <card>
        <rank>5</rank>
        <suit>SPADES</suit>
    </card>
    <card>
        <rank>10</rank>
        <suit>SPADES</suit>
    </card>
    <card>
        <rank>J</rank>
        <suit>DIAMONDS</suit>
    </card>
    <card>
        <rank>9</rank>
        <suit>SPADES</suit>
    </card>
    <card>
        <rank>8</rank>
        <suit>HEARTS</suit>
    </card>
    <card>
        <rank>K</rank>
        <suit>DIAMONDS</suit>
    </card>
    <card>
        <rank>2</rank>
        <suit>DIAMONDS</suit>
    </card>
    <card>
        <rank>A</rank>
        <suit>HEARTS</suit>
    </card>
    <card>
        <rank>9</rank>
        <suit>CLUBS</suit>
    </card>
    <card>
        <rank>4</rank>
        <suit>DIAMONDS</suit>
    </card>
    <card>
        <rank>10</rank>
        <suit>CLUBS</suit>
    </card>
    <card>
        <rank>5</rank>
        <suit>DIAMONDS</suit>
    </card>
    <card>
        <rank>3</rank>
        <suit>CLUBS</suit>
    </card>
    <card>
        <rank>7</rank>
        <suit>SPADES</suit>
    </card>
    <card>
        <rank>K</rank>
        <suit>CLUBS</suit>
    </card>
    <card>
        <rank>3</rank>
        <suit>HEARTS</suit>
    </card>
    <card>
        <rank>8</rank>
        <suit>CLUBS</suit>
    </card>
    <card>
        <rank>4</rank>
        <suit>SPADES</suit>
    </card>
    <card>
        <rank>3</rank>
        <suit>SPADES</suit>
    </card>
    <card>
        <rank>Q</rank>
        <suit>DIAMONDS</suit>
    </card>
    <card>
        <rank>6</rank>
        <suit>HEARTS</suit>
    </card>
    <card>
        <rank>4</rank>
        <suit>CLUBS</suit>
    </card>
    <card>
        <rank>6</rank>
        <suit>DIAMONDS</suit>
    </card>
    <card>
        <rank>A</rank>
        <suit>CLUBS</suit>
    </card>
    <card>
        <rank>2</rank>
        <suit>HEARTS</suit>
    </card>
    <card>
        <rank>A</rank>
        <suit>SPADES</suit>
    </card>
    <card>
        <rank>J</rank>
        <suit>HEARTS</suit>
    </card>
    <card>
        <rank>Q</rank>
        <suit>CLUBS</suit>
    </card>
    <card>
        <rank>8</rank>
        <suit>SPADES</suit>
    </card>
    <card>
        <rank>9</rank>
        <suit>HEARTS</suit>
    </card>
</stack>
